{"run_id":"20260313_112050","timestamp":"2026-03-13T11:20:50.721590Z","params_snapshot":{},"hypothesis":"","mean_oss":0.0,"mean_coherence":0.0,"noise_rate":0.0,"actionable_rate":0.0,"article_count":23,"cluster_count":0,"status":"keep","reason":"","learning_updates":{}}
{"run_id":"20260313_112050","timestamp":"2026-03-13T11:20:51.143912Z","params_snapshot":{},"hypothesis":"","mean_oss":0.0,"mean_coherence":0.0,"noise_rate":0.0,"actionable_rate":0.0,"article_count":23,"cluster_count":0,"status":"keep","reason":"","learning_updates":{}}
{"run_id":"20260313_112051","timestamp":"2026-03-13T11:20:51.871354Z","params_snapshot":{},"hypothesis":"","mean_oss":0.0,"mean_coherence":0.0,"noise_rate":0.0,"actionable_rate":0.0,"article_count":23,"cluster_count":0,"status":"keep","reason":"","learning_updates":{}}
{"run_id":"20260313_112052","timestamp":"2026-03-13T11:20:52.752097Z","params_snapshot":{},"hypothesis":"","mean_oss":0.0,"mean_coherence":0.0,"noise_rate":0.0,"actionable_rate":0.0,"article_count":23,"cluster_count":0,"status":"keep","reason":"","learning_updates":{}}
{"run_id":"20260313_112053","timestamp":"2026-03-13T11:20:53.389631Z","params_snapshot":{},"hypothesis":"","mean_oss":0.0,"mean_coherence":0.0,"noise_rate":0.0,"actionable_rate":0.0,"article_count":23,"cluster_count":0,"status":"keep","reason":"","learning_updates":{}}
{"run_id":"20260313_112053","timestamp":"2026-03-13T11:20:53.853575Z","params_snapshot":{},"hypothesis":"","mean_oss":0.0,"mean_coherence":0.0,"noise_rate":0.0,"actionable_rate":0.0,"article_count":23,"cluster_count":0,"status":"keep","reason":"","learning_updates":{}}
{"run_id":"20260313_112423","timestamp":"2026-03-13T11:24:24.301487Z","params_snapshot":{},"hypothesis":"","mean_oss":0.0,"mean_coherence":0.0,"noise_rate":0.0,"actionable_rate":0.0,"article_count":23,"cluster_count":0,"status":"keep","reason":"","learning_updates":{}}
{"run_id":"20260313_112425","timestamp":"2026-03-13T11:24:25.408673Z","params_snapshot":{},"hypothesis":"","mean_oss":0.0,"mean_coherence":0.0,"noise_rate":0.0,"actionable_rate":0.0,"article_count":17,"cluster_count":0,"status":"keep","reason":"","learning_updates":{}}
{"run_id":"20260313_112426","timestamp":"2026-03-13T11:24:26.233656Z","params_snapshot":{},"hypothesis":"","mean_oss":0.0,"mean_coherence":0.0,"noise_rate":0.0,"actionable_rate":0.0,"article_count":17,"cluster_count":0,"status":"keep","reason":"","learning_updates":{}}
{"run_id":"20260313_112426","timestamp":"2026-03-13T11:24:27.127933Z","params_snapshot":{},"hypothesis":"","mean_oss":0.0,"mean_coherence":0.0,"noise_rate":0.0,"actionable_rate":0.0,"article_count":17,"cluster_count":0,"status":"keep","reason":"","learning_updates":{}}
{"run_id":"20260313_112427","timestamp":"2026-03-13T11:24:27.437986Z","params_snapshot":{},"hypothesis":"","mean_oss":0.0,"mean_coherence":0.0,"noise_rate":0.0,"actionable_rate":0.0,"article_count":17,"cluster_count":0,"status":"keep","reason":"","learning_updates":{}}
{"run_id":"20260313_112427","timestamp":"2026-03-13T11:24:27.797762Z","params_snapshot":{},"hypothesis":"","mean_oss":0.0,"mean_coherence":0.0,"noise_rate":0.0,"actionable_rate":0.0,"article_count":17,"cluster_count":0,"status":"keep","reason":"","learning_updates":{}}
{"run_id":"20260313_112609","timestamp":"2026-03-13T11:26:09.192159Z","params_snapshot":{},"hypothesis":"","mean_oss":0.0,"mean_coherence":0.0,"noise_rate":0.0,"actionable_rate":0.0,"article_count":23,"cluster_count":0,"status":"keep","reason":"","learning_updates":{}}
{"run_id":"20260313_112609","timestamp":"2026-03-13T11:26:10.124267Z","params_snapshot":{},"hypothesis":"","mean_oss":0.0,"mean_coherence":0.0,"noise_rate":0.0,"actionable_rate":0.0,"article_count":17,"cluster_count":0,"status":"keep","reason":"","learning_updates":{}}
{"run_id":"20260313_112610","timestamp":"2026-03-13T11:26:10.984099Z","params_snapshot":{},"hypothesis":"","mean_oss":0.0,"mean_coherence":0.0,"noise_rate":0.0,"actionable_rate":0.0,"article_count":17,"cluster_count":0,"status":"keep","reason":"","learning_updates":{}}
