{"run_id":"20260312_021140","timestamp":"2026-03-12T02:12:04.896928Z","params_snapshot":{},"hypothesis":"","mean_oss":0.0,"mean_coherence":0.0,"noise_rate":0.0,"actionable_rate":0.0,"article_count":17,"cluster_count":0,"status":"discard","reason":"regression detected  - rolled back weights + thresholds","learning_updates":{}}
{"run_id":"20260312_021221","timestamp":"2026-03-12T02:12:44.795255Z","params_snapshot":{},"hypothesis":"","mean_oss":0.0,"mean_coherence":0.0,"noise_rate":0.0,"actionable_rate":0.0,"article_count":17,"cluster_count":0,"status":"discard","reason":"regression detected  - rolled back weights + thresholds","learning_updates":{}}
{"run_id":"20260312_022919","timestamp":"2026-03-12T02:29:44.477882Z","params_snapshot":{},"hypothesis":"","mean_oss":0.0,"mean_coherence":0.0,"noise_rate":0.0,"actionable_rate":0.0,"article_count":17,"cluster_count":0,"status":"discard","reason":"regression detected  - rolled back weights + thresholds","learning_updates":{}}
{"run_id":"20260312_022957","timestamp":"2026-03-12T02:30:20.597873Z","params_snapshot":{},"hypothesis":"","mean_oss":0.0,"mean_coherence":0.0,"noise_rate":0.0,"actionable_rate":0.0,"article_count":17,"cluster_count":0,"status":"discard","reason":"regression detected  - rolled back weights + thresholds","learning_updates":{}}
{"run_id":"20260312_023036","timestamp":"2026-03-12T02:30:59.984637Z","params_snapshot":{},"hypothesis":"","mean_oss":0.0,"mean_coherence":0.0,"noise_rate":0.0,"actionable_rate":0.0,"article_count":17,"cluster_count":0,"status":"discard","reason":"regression detected  - rolled back weights + thresholds","learning_updates":{}}
{"run_id":"20260312_023556","timestamp":"2026-03-12T02:36:21.917530Z","params_snapshot":{},"hypothesis":"","mean_oss":0.0,"mean_coherence":0.0,"noise_rate":0.0,"actionable_rate":0.0,"article_count":17,"cluster_count":0,"status":"discard","reason":"regression detected  - rolled back weights + thresholds","learning_updates":{}}
{"run_id":"20260312_023621","timestamp":"2026-03-12T02:36:31.792916Z","params_snapshot":{},"hypothesis":"","mean_oss":0.0,"mean_coherence":0.0,"noise_rate":0.0,"actionable_rate":0.0,"article_count":17,"cluster_count":0,"status":"discard","reason":"regression detected  - rolled back weights + thresholds","learning_updates":{}}
{"run_id":"20260312_023631","timestamp":"2026-03-12T02:36:40.802616Z","params_snapshot":{},"hypothesis":"","mean_oss":0.0,"mean_coherence":0.0,"noise_rate":0.0,"actionable_rate":0.0,"article_count":17,"cluster_count":0,"status":"discard","reason":"regression detected  - rolled back weights + thresholds","learning_updates":{}}
{"run_id":"20260312_030705","timestamp":"2026-03-12T03:07:29.906240Z","params_snapshot":{},"hypothesis":"","mean_oss":0.0,"mean_coherence":0.0,"noise_rate":0.0,"actionable_rate":0.0,"article_count":17,"cluster_count":0,"status":"discard","reason":"regression detected  - rolled back weights + thresholds","learning_updates":{}}
{"run_id":"20260312_030729","timestamp":"2026-03-12T03:07:39.781930Z","params_snapshot":{},"hypothesis":"","mean_oss":0.0,"mean_coherence":0.0,"noise_rate":0.0,"actionable_rate":0.0,"article_count":17,"cluster_count":0,"status":"discard","reason":"regression detected  - rolled back weights + thresholds","learning_updates":{}}
{"run_id":"20260312_030739","timestamp":"2026-03-12T03:07:48.615582Z","params_snapshot":{},"hypothesis":"","mean_oss":0.0,"mean_coherence":0.0,"noise_rate":0.0,"actionable_rate":0.0,"article_count":17,"cluster_count":0,"status":"discard","reason":"regression detected  - rolled back weights + thresholds","learning_updates":{}}
{"run_id":"20260312_031741","timestamp":"2026-03-12T03:18:05.604618Z","params_snapshot":{},"hypothesis":"","mean_oss":0.0,"mean_coherence":0.0,"noise_rate":0.0,"actionable_rate":0.0,"article_count":17,"cluster_count":0,"status":"discard","reason":"regression detected  - rolled back weights + thresholds","learning_updates":{}}
{"run_id":"20260312_031805","timestamp":"2026-03-12T03:18:14.729816Z","params_snapshot":{},"hypothesis":"","mean_oss":0.0,"mean_coherence":0.0,"noise_rate":0.0,"actionable_rate":0.0,"article_count":17,"cluster_count":0,"status":"keep","reason":"","learning_updates":{}}
{"run_id":"20260312_031814","timestamp":"2026-03-12T03:18:22.775290Z","params_snapshot":{},"hypothesis":"","mean_oss":0.0,"mean_coherence":0.0,"noise_rate":0.0,"actionable_rate":0.0,"article_count":17,"cluster_count":0,"status":"keep","reason":"","learning_updates":{}}
{"run_id":"20260312_031853","timestamp":"2026-03-12T03:19:17.297281Z","params_snapshot":{},"hypothesis":"","mean_oss":0.0,"mean_coherence":0.0,"noise_rate":0.0,"actionable_rate":0.0,"article_count":17,"cluster_count":0,"status":"keep","reason":"","learning_updates":{}}
{"run_id":"20260312_032314","timestamp":"2026-03-12T03:23:34.843786Z","params_snapshot":{},"hypothesis":"","mean_oss":0.0,"mean_coherence":0.0,"noise_rate":0.0,"actionable_rate":0.0,"article_count":17,"cluster_count":0,"status":"keep","reason":"","learning_updates":{}}
{"run_id":"20260312_032334","timestamp":"2026-03-12T03:23:39.021685Z","params_snapshot":{},"hypothesis":"","mean_oss":0.0,"mean_coherence":0.0,"noise_rate":0.0,"actionable_rate":0.0,"article_count":17,"cluster_count":0,"status":"keep","reason":"","learning_updates":{}}
{"run_id":"20260312_032339","timestamp":"2026-03-12T03:23:43.174464Z","params_snapshot":{},"hypothesis":"","mean_oss":0.0,"mean_coherence":0.0,"noise_rate":0.0,"actionable_rate":0.0,"article_count":17,"cluster_count":0,"status":"keep","reason":"","learning_updates":{}}
{"run_id":"20260312_032624","timestamp":"2026-03-12T03:26:41.206906Z","params_snapshot":{},"hypothesis":"","mean_oss":0.0,"mean_coherence":0.0,"noise_rate":0.0,"actionable_rate":0.0,"article_count":17,"cluster_count":0,"status":"keep","reason":"","learning_updates":{}}
{"run_id":"20260312_032641","timestamp":"2026-03-12T03:26:44.445290Z","params_snapshot":{},"hypothesis":"","mean_oss":0.0,"mean_coherence":0.0,"noise_rate":0.0,"actionable_rate":0.0,"article_count":17,"cluster_count":0,"status":"keep","reason":"","learning_updates":{}}
{"run_id":"20260312_032809","timestamp":"2026-03-12T03:28:12.192966Z","params_snapshot":{},"hypothesis":"","mean_oss":0.0,"mean_coherence":0.0,"noise_rate":0.0,"actionable_rate":0.0,"article_count":17,"cluster_count":0,"status":"keep","reason":"","learning_updates":{}}
{"run_id":"20260312_032812","timestamp":"2026-03-12T03:28:12.355702Z","params_snapshot":{},"hypothesis":"","mean_oss":0.0,"mean_coherence":0.0,"noise_rate":0.0,"actionable_rate":0.0,"article_count":17,"cluster_count":0,"status":"keep","reason":"","learning_updates":{}}
{"run_id":"20260312_032812","timestamp":"2026-03-12T03:28:12.862733Z","params_snapshot":{},"hypothesis":"","mean_oss":0.0,"mean_coherence":0.0,"noise_rate":0.0,"actionable_rate":0.0,"article_count":17,"cluster_count":0,"status":"keep","reason":"","learning_updates":{}}
{"run_id":"20260312_033242","timestamp":"2026-03-12T03:32:45.095798Z","params_snapshot":{},"hypothesis":"","mean_oss":0.0,"mean_coherence":0.0,"noise_rate":0.0,"actionable_rate":0.0,"article_count":17,"cluster_count":0,"status":"keep","reason":"","learning_updates":{}}
{"run_id":"20260312_033245","timestamp":"2026-03-12T03:32:45.256792Z","params_snapshot":{},"hypothesis":"","mean_oss":0.0,"mean_coherence":0.0,"noise_rate":0.0,"actionable_rate":0.0,"article_count":17,"cluster_count":0,"status":"keep","reason":"","learning_updates":{}}
{"run_id":"20260312_033245","timestamp":"2026-03-12T03:32:45.739820Z","params_snapshot":{},"hypothesis":"","mean_oss":0.0,"mean_coherence":0.0,"noise_rate":0.0,"actionable_rate":0.0,"article_count":17,"cluster_count":0,"status":"keep","reason":"","learning_updates":{}}
{"run_id":"20260312_034132","timestamp":"2026-03-12T03:41:34.955206Z","params_snapshot":{},"hypothesis":"","mean_oss":0.0,"mean_coherence":0.0,"noise_rate":0.0,"actionable_rate":0.0,"article_count":17,"cluster_count":0,"status":"keep","reason":"","learning_updates":{}}
{"run_id":"20260312_034134","timestamp":"2026-03-12T03:41:35.117205Z","params_snapshot":{},"hypothesis":"","mean_oss":0.0,"mean_coherence":0.0,"noise_rate":0.0,"actionable_rate":0.0,"article_count":17,"cluster_count":0,"status":"keep","reason":"","learning_updates":{}}
{"run_id":"20260312_034135","timestamp":"2026-03-12T03:41:35.622203Z","params_snapshot":{},"hypothesis":"","mean_oss":0.0,"mean_coherence":0.0,"noise_rate":0.0,"actionable_rate":0.0,"article_count":17,"cluster_count":0,"status":"keep","reason":"","learning_updates":{}}
{"run_id":"20260312_035155","timestamp":"2026-03-12T03:51:58.476521Z","params_snapshot":{},"hypothesis":"","mean_oss":0.0,"mean_coherence":0.0,"noise_rate":0.0,"actionable_rate":0.0,"article_count":17,"cluster_count":0,"status":"keep","reason":"","learning_updates":{}}
{"run_id":"20260312_035158","timestamp":"2026-03-12T03:51:58.638598Z","params_snapshot":{},"hypothesis":"","mean_oss":0.0,"mean_coherence":0.0,"noise_rate":0.0,"actionable_rate":0.0,"article_count":17,"cluster_count":0,"status":"keep","reason":"","learning_updates":{}}
{"run_id":"20260312_035158","timestamp":"2026-03-12T03:51:59.136220Z","params_snapshot":{},"hypothesis":"","mean_oss":0.0,"mean_coherence":0.0,"noise_rate":0.0,"actionable_rate":0.0,"article_count":17,"cluster_count":0,"status":"keep","reason":"","learning_updates":{}}
{"run_id":"20260312_040054","timestamp":"2026-03-12T04:00:56.954427Z","params_snapshot":{},"hypothesis":"","mean_oss":0.0,"mean_coherence":0.0,"noise_rate":0.0,"actionable_rate":0.0,"article_count":17,"cluster_count":0,"status":"keep","reason":"","learning_updates":{}}
{"run_id":"20260312_040056","timestamp":"2026-03-12T04:00:57.125483Z","params_snapshot":{},"hypothesis":"","mean_oss":0.0,"mean_coherence":0.0,"noise_rate":0.0,"actionable_rate":0.0,"article_count":17,"cluster_count":0,"status":"keep","reason":"","learning_updates":{}}
{"run_id":"20260312_040057","timestamp":"2026-03-12T04:00:57.639662Z","params_snapshot":{},"hypothesis":"","mean_oss":0.0,"mean_coherence":0.0,"noise_rate":0.0,"actionable_rate":0.0,"article_count":17,"cluster_count":0,"status":"keep","reason":"","learning_updates":{}}
{"run_id":"20260312_040603","timestamp":"2026-03-12T04:06:06.475324Z","params_snapshot":{},"hypothesis":"","mean_oss":0.0,"mean_coherence":0.0,"noise_rate":0.0,"actionable_rate":0.0,"article_count":17,"cluster_count":0,"status":"keep","reason":"","learning_updates":{}}
{"run_id":"20260312_040606","timestamp":"2026-03-12T04:06:06.634323Z","params_snapshot":{},"hypothesis":"","mean_oss":0.0,"mean_coherence":0.0,"noise_rate":0.0,"actionable_rate":0.0,"article_count":17,"cluster_count":0,"status":"keep","reason":"","learning_updates":{}}
{"run_id":"20260312_040606","timestamp":"2026-03-12T04:06:07.139966Z","params_snapshot":{},"hypothesis":"","mean_oss":0.0,"mean_coherence":0.0,"noise_rate":0.0,"actionable_rate":0.0,"article_count":17,"cluster_count":0,"status":"keep","reason":"","learning_updates":{}}
{"run_id":"20260312_041100","timestamp":"2026-03-12T04:11:03.561510Z","params_snapshot":{},"hypothesis":"","mean_oss":0.0,"mean_coherence":0.0,"noise_rate":0.0,"actionable_rate":0.0,"article_count":17,"cluster_count":0,"status":"keep","reason":"","learning_updates":{}}
{"run_id":"20260312_041103","timestamp":"2026-03-12T04:11:03.723542Z","params_snapshot":{},"hypothesis":"","mean_oss":0.0,"mean_coherence":0.0,"noise_rate":0.0,"actionable_rate":0.0,"article_count":17,"cluster_count":0,"status":"keep","reason":"","learning_updates":{}}
{"run_id":"20260312_041103","timestamp":"2026-03-12T04:11:04.256003Z","params_snapshot":{},"hypothesis":"","mean_oss":0.0,"mean_coherence":0.0,"noise_rate":0.0,"actionable_rate":0.0,"article_count":17,"cluster_count":0,"status":"keep","reason":"","learning_updates":{}}
{"run_id":"20260312_045619","timestamp":"2026-03-12T04:56:21.940481Z","params_snapshot":{},"hypothesis":"","mean_oss":0.0,"mean_coherence":0.0,"noise_rate":0.0,"actionable_rate":0.0,"article_count":17,"cluster_count":0,"status":"keep","reason":"","learning_updates":{}}
{"run_id":"20260312_045621","timestamp":"2026-03-12T04:56:22.096498Z","params_snapshot":{},"hypothesis":"","mean_oss":0.0,"mean_coherence":0.0,"noise_rate":0.0,"actionable_rate":0.0,"article_count":17,"cluster_count":0,"status":"keep","reason":"","learning_updates":{}}
{"run_id":"20260312_045622","timestamp":"2026-03-12T04:56:22.619967Z","params_snapshot":{},"hypothesis":"","mean_oss":0.0,"mean_coherence":0.0,"noise_rate":0.0,"actionable_rate":0.0,"article_count":17,"cluster_count":0,"status":"keep","reason":"","learning_updates":{}}
{"run_id":"20260312_045832","timestamp":"2026-03-12T04:58:35.031581Z","params_snapshot":{},"hypothesis":"","mean_oss":0.0,"mean_coherence":0.0,"noise_rate":0.0,"actionable_rate":0.0,"article_count":17,"cluster_count":0,"status":"keep","reason":"","learning_updates":{}}
{"run_id":"20260312_045911","timestamp":"2026-03-12T04:59:13.838320Z","params_snapshot":{},"hypothesis":"","mean_oss":0.0,"mean_coherence":0.0,"noise_rate":0.0,"actionable_rate":0.0,"article_count":17,"cluster_count":0,"status":"keep","reason":"","learning_updates":{}}
{"run_id":"20260312_045923","timestamp":"2026-03-12T04:59:25.802188Z","params_snapshot":{},"hypothesis":"","mean_oss":0.0,"mean_coherence":0.0,"noise_rate":0.0,"actionable_rate":0.0,"article_count":17,"cluster_count":0,"status":"keep","reason":"","learning_updates":{}}
{"run_id":"20260312_045935","timestamp":"2026-03-12T04:59:38.479885Z","params_snapshot":{},"hypothesis":"","mean_oss":0.0,"mean_coherence":0.0,"noise_rate":0.0,"actionable_rate":0.0,"article_count":17,"cluster_count":0,"status":"keep","reason":"","learning_updates":{}}
{"run_id":"20260312_050003","timestamp":"2026-03-12T05:00:06.449132Z","params_snapshot":{},"hypothesis":"","mean_oss":0.0,"mean_coherence":0.0,"noise_rate":0.0,"actionable_rate":0.0,"article_count":17,"cluster_count":0,"status":"keep","reason":"","learning_updates":{}}
{"run_id":"20260312_050138","timestamp":"2026-03-12T05:01:41.524567Z","params_snapshot":{},"hypothesis":"","mean_oss":0.0,"mean_coherence":0.0,"noise_rate":0.0,"actionable_rate":0.0,"article_count":17,"cluster_count":0,"status":"keep","reason":"","learning_updates":{}}
{"run_id":"20260312_050331","timestamp":"2026-03-12T05:03:34.430167Z","params_snapshot":{},"hypothesis":"","mean_oss":0.0,"mean_coherence":0.0,"noise_rate":0.0,"actionable_rate":0.0,"article_count":17,"cluster_count":0,"status":"keep","reason":"","learning_updates":{}}
{"run_id":"20260312_050457","timestamp":"2026-03-12T05:05:31.986174Z","params_snapshot":{},"hypothesis":"","mean_oss":0.0,"mean_coherence":0.0,"noise_rate":0.0,"actionable_rate":0.0,"article_count":17,"cluster_count":0,"status":"keep","reason":"","learning_updates":{}}
{"run_id":"20260312_050551","timestamp":"2026-03-12T05:06:25.343614Z","params_snapshot":{},"hypothesis":"","mean_oss":0.0,"mean_coherence":0.0,"noise_rate":0.0,"actionable_rate":0.0,"article_count":17,"cluster_count":0,"status":"keep","reason":"","learning_updates":{}}
{"run_id":"20260312_050625","timestamp":"2026-03-12T05:31:08.726508Z","params_snapshot":{},"hypothesis":"","mean_oss":0.0,"mean_coherence":0.0,"noise_rate":0.0,"actionable_rate":0.0,"article_count":17,"cluster_count":0,"status":"keep","reason":"","learning_updates":{}}
{"run_id":"20260312_053108","timestamp":"2026-03-12T05:31:23.209268Z","params_snapshot":{},"hypothesis":"","mean_oss":0.0,"mean_coherence":0.0,"noise_rate":0.0,"actionable_rate":0.0,"article_count":17,"cluster_count":0,"status":"keep","reason":"","learning_updates":{}}
{"run_id":"20260312_053520","timestamp":"2026-03-12T05:36:07.602476Z","params_snapshot":{},"hypothesis":"","mean_oss":0.0,"mean_coherence":0.0,"noise_rate":0.0,"actionable_rate":0.0,"article_count":17,"cluster_count":0,"status":"keep","reason":"","learning_updates":{}}
{"run_id":"20260312_053717","timestamp":"2026-03-12T05:37:46.144377Z","params_snapshot":{},"hypothesis":"","mean_oss":0.0,"mean_coherence":0.0,"noise_rate":0.0,"actionable_rate":0.0,"article_count":17,"cluster_count":0,"status":"keep","reason":"","learning_updates":{}}
{"run_id":"20260312_053746","timestamp":"2026-03-12T05:38:10.224140Z","params_snapshot":{},"hypothesis":"","mean_oss":0.0,"mean_coherence":0.0,"noise_rate":0.0,"actionable_rate":0.0,"article_count":17,"cluster_count":0,"status":"keep","reason":"","learning_updates":{}}
{"run_id":"20260312_053810","timestamp":"2026-03-12T05:38:31.385730Z","params_snapshot":{},"hypothesis":"","mean_oss":0.0,"mean_coherence":0.0,"noise_rate":0.0,"actionable_rate":0.0,"article_count":17,"cluster_count":0,"status":"keep","reason":"","learning_updates":{}}
{"run_id":"20260312_053843","timestamp":"2026-03-12T05:39:12.354658Z","params_snapshot":{},"hypothesis":"","mean_oss":0.0,"mean_coherence":0.0,"noise_rate":0.0,"actionable_rate":0.0,"article_count":17,"cluster_count":0,"status":"keep","reason":"","learning_updates":{}}
{"run_id":"20260312_053938","timestamp":"2026-03-12T05:40:09.866227Z","params_snapshot":{},"hypothesis":"","mean_oss":0.0,"mean_coherence":0.0,"noise_rate":0.0,"actionable_rate":0.0,"article_count":17,"cluster_count":0,"status":"keep","reason":"","learning_updates":{}}
{"run_id":"20260312_080229","timestamp":"2026-03-12T08:03:05.499875Z","params_snapshot":{},"hypothesis":"","mean_oss":0.0,"mean_coherence":0.0,"noise_rate":0.0,"actionable_rate":0.0,"article_count":17,"cluster_count":0,"status":"keep","reason":"","learning_updates":{}}
{"run_id":"20260312_080320","timestamp":"2026-03-12T08:03:54.811966Z","params_snapshot":{},"hypothesis":"","mean_oss":0.0,"mean_coherence":0.0,"noise_rate":0.0,"actionable_rate":0.0,"article_count":17,"cluster_count":0,"status":"keep","reason":"","learning_updates":{}}
{"run_id":"20260312_080354","timestamp":"2026-03-12T08:04:22.810256Z","params_snapshot":{},"hypothesis":"","mean_oss":0.0,"mean_coherence":0.0,"noise_rate":0.0,"actionable_rate":0.0,"article_count":17,"cluster_count":0,"status":"keep","reason":"","learning_updates":{}}
{"run_id":"20260312_080422","timestamp":"2026-03-12T08:04:57.560189Z","params_snapshot":{},"hypothesis":"","mean_oss":0.0,"mean_coherence":0.0,"noise_rate":0.0,"actionable_rate":0.0,"article_count":17,"cluster_count":0,"status":"keep","reason":"","learning_updates":{}}
{"run_id":"20260312_080707","timestamp":"2026-03-12T08:07:10.046960Z","params_snapshot":{},"hypothesis":"","mean_oss":0.0,"mean_coherence":0.0,"noise_rate":0.0,"actionable_rate":0.0,"article_count":17,"cluster_count":0,"status":"keep","reason":"","learning_updates":{}}
{"run_id":"20260312_080710","timestamp":"2026-03-12T08:07:10.163115Z","params_snapshot":{},"hypothesis":"","mean_oss":0.0,"mean_coherence":0.0,"noise_rate":0.0,"actionable_rate":0.0,"article_count":17,"cluster_count":0,"status":"keep","reason":"","learning_updates":{}}
{"run_id":"20260312_080710","timestamp":"2026-03-12T08:07:10.664458Z","params_snapshot":{},"hypothesis":"","mean_oss":0.0,"mean_coherence":0.0,"noise_rate":0.0,"actionable_rate":0.0,"article_count":17,"cluster_count":0,"status":"keep","reason":"","learning_updates":{}}
{"run_id":"20260312_081711","timestamp":"2026-03-12T08:17:14.228189Z","params_snapshot":{},"hypothesis":"","mean_oss":0.0,"mean_coherence":0.0,"noise_rate":0.0,"actionable_rate":0.0,"article_count":17,"cluster_count":0,"status":"keep","reason":"","learning_updates":{}}
{"run_id":"20260312_081714","timestamp":"2026-03-12T08:17:14.342168Z","params_snapshot":{},"hypothesis":"","mean_oss":0.0,"mean_coherence":0.0,"noise_rate":0.0,"actionable_rate":0.0,"article_count":17,"cluster_count":0,"status":"keep","reason":"","learning_updates":{}}
{"run_id":"20260312_081714","timestamp":"2026-03-12T08:17:14.843023Z","params_snapshot":{},"hypothesis":"","mean_oss":0.0,"mean_coherence":0.0,"noise_rate":0.0,"actionable_rate":0.0,"article_count":17,"cluster_count":0,"status":"keep","reason":"","learning_updates":{}}
{"run_id":"20260312_082159","timestamp":"2026-03-12T08:22:02.623495Z","params_snapshot":{},"hypothesis":"","mean_oss":0.0,"mean_coherence":0.0,"noise_rate":0.0,"actionable_rate":0.0,"article_count":17,"cluster_count":0,"status":"keep","reason":"","learning_updates":{}}
{"run_id":"20260312_082258","timestamp":"2026-03-12T08:23:00.806786Z","params_snapshot":{},"hypothesis":"","mean_oss":0.0,"mean_coherence":0.0,"noise_rate":0.0,"actionable_rate":0.0,"article_count":17,"cluster_count":0,"status":"keep","reason":"","learning_updates":{}}
{"run_id":"20260312_083328","timestamp":"2026-03-12T08:33:31.348095Z","params_snapshot":{},"hypothesis":"","mean_oss":0.0,"mean_coherence":0.0,"noise_rate":0.0,"actionable_rate":0.0,"article_count":17,"cluster_count":0,"status":"keep","reason":"","learning_updates":{}}
{"run_id":"20260312_083356","timestamp":"2026-03-12T08:33:59.126861Z","params_snapshot":{},"hypothesis":"","mean_oss":0.0,"mean_coherence":0.0,"noise_rate":0.0,"actionable_rate":0.0,"article_count":17,"cluster_count":0,"status":"keep","reason":"","learning_updates":{}}
{"run_id":"20260312_083510","timestamp":"2026-03-12T08:35:13.041831Z","params_snapshot":{},"hypothesis":"","mean_oss":0.0,"mean_coherence":0.0,"noise_rate":0.0,"actionable_rate":0.0,"article_count":17,"cluster_count":0,"status":"keep","reason":"","learning_updates":{}}
{"run_id":"20260312_083753","timestamp":"2026-03-12T08:37:55.869034Z","params_snapshot":{},"hypothesis":"","mean_oss":0.0,"mean_coherence":0.0,"noise_rate":0.0,"actionable_rate":0.0,"article_count":17,"cluster_count":0,"status":"keep","reason":"","learning_updates":{}}
{"run_id":"20260312_084021","timestamp":"2026-03-12T08:40:23.659080Z","params_snapshot":{},"hypothesis":"","mean_oss":0.0,"mean_coherence":0.0,"noise_rate":0.0,"actionable_rate":0.0,"article_count":17,"cluster_count":0,"status":"keep","reason":"","learning_updates":{}}
