{"run_id":"20260312_084023","timestamp":"2026-03-12T08:40:23.783105Z","params_snapshot":{},"hypothesis":"","mean_oss":0.0,"mean_coherence":0.0,"noise_rate":0.0,"actionable_rate":0.0,"article_count":17,"cluster_count":0,"status":"keep","reason":"","learning_updates":{}}
{"run_id":"20260312_084023","timestamp":"2026-03-12T08:40:24.307672Z","params_snapshot":{},"hypothesis":"","mean_oss":0.0,"mean_coherence":0.0,"noise_rate":0.0,"actionable_rate":0.0,"article_count":17,"cluster_count":0,"status":"keep","reason":"","learning_updates":{}}
{"run_id":"20260312_084142","timestamp":"2026-03-12T08:41:43.710001Z","params_snapshot":{},"hypothesis":"","mean_oss":0.0,"mean_coherence":0.0,"noise_rate":0.0,"actionable_rate":0.0,"article_count":17,"cluster_count":0,"status":"keep","reason":"","learning_updates":{}}
{"run_id":"20260312_084202","timestamp":"2026-03-12T08:42:03.650871Z","params_snapshot":{},"hypothesis":"","mean_oss":0.0,"mean_coherence":0.0,"noise_rate":0.0,"actionable_rate":0.0,"article_count":17,"cluster_count":0,"status":"keep","reason":"","learning_updates":{}}
{"run_id":"20260312_084320","timestamp":"2026-03-12T08:43:23.215536Z","params_snapshot":{},"hypothesis":"","mean_oss":0.0,"mean_coherence":0.0,"noise_rate":0.0,"actionable_rate":0.0,"article_count":17,"cluster_count":0,"status":"keep","reason":"","learning_updates":{}}
{"run_id":"20260312_084323","timestamp":"2026-03-12T08:43:23.347537Z","params_snapshot":{},"hypothesis":"","mean_oss":0.0,"mean_coherence":0.0,"noise_rate":0.0,"actionable_rate":0.0,"article_count":17,"cluster_count":0,"status":"keep","reason":"","learning_updates":{}}
{"run_id":"20260312_084323","timestamp":"2026-03-12T08:43:23.837549Z","params_snapshot":{},"hypothesis":"","mean_oss":0.0,"mean_coherence":0.0,"noise_rate":0.0,"actionable_rate":0.0,"article_count":17,"cluster_count":0,"status":"keep","reason":"","learning_updates":{}}
{"run_id":"20260312_085124","timestamp":"2026-03-12T08:51:27.242853Z","params_snapshot":{},"hypothesis":"","mean_oss":0.0,"mean_coherence":0.0,"noise_rate":0.0,"actionable_rate":0.0,"article_count":17,"cluster_count":0,"status":"keep","reason":"","learning_updates":{}}
{"run_id":"20260312_085127","timestamp":"2026-03-12T08:51:27.388868Z","params_snapshot":{},"hypothesis":"","mean_oss":0.0,"mean_coherence":0.0,"noise_rate":0.0,"actionable_rate":0.0,"article_count":17,"cluster_count":0,"status":"keep","reason":"","learning_updates":{}}
{"run_id":"20260312_085127","timestamp":"2026-03-12T08:51:27.857702Z","params_snapshot":{},"hypothesis":"","mean_oss":0.0,"mean_coherence":0.0,"noise_rate":0.0,"actionable_rate":0.0,"article_count":17,"cluster_count":0,"status":"keep","reason":"","learning_updates":{}}
{"run_id":"20260312_085141","timestamp":"2026-03-12T08:51:44.641018Z","params_snapshot":{},"hypothesis":"","mean_oss":0.0,"mean_coherence":0.0,"noise_rate":0.0,"actionable_rate":0.0,"article_count":17,"cluster_count":0,"status":"keep","reason":"","learning_updates":{}}
{"run_id":"20260312_085203","timestamp":"2026-03-12T08:52:06.443180Z","params_snapshot":{},"hypothesis":"","mean_oss":0.0,"mean_coherence":0.0,"noise_rate":0.0,"actionable_rate":0.0,"article_count":17,"cluster_count":0,"status":"keep","reason":"","learning_updates":{}}
{"run_id":"20260312_085206","timestamp":"2026-03-12T08:52:06.587180Z","params_snapshot":{},"hypothesis":"","mean_oss":0.0,"mean_coherence":0.0,"noise_rate":0.0,"actionable_rate":0.0,"article_count":17,"cluster_count":0,"status":"keep","reason":"","learning_updates":{}}
{"run_id":"20260312_085206","timestamp":"2026-03-12T08:52:07.063748Z","params_snapshot":{},"hypothesis":"","mean_oss":0.0,"mean_coherence":0.0,"noise_rate":0.0,"actionable_rate":0.0,"article_count":17,"cluster_count":0,"status":"keep","reason":"","learning_updates":{}}
{"run_id":"20260312_085230","timestamp":"2026-03-12T08:52:33.045827Z","params_snapshot":{},"hypothesis":"","mean_oss":0.0,"mean_coherence":0.0,"noise_rate":0.0,"actionable_rate":0.0,"article_count":17,"cluster_count":0,"status":"keep","reason":"","learning_updates":{}}
{"run_id":"20260312_085247","timestamp":"2026-03-12T08:52:50.496016Z","params_snapshot":{},"hypothesis":"","mean_oss":0.0,"mean_coherence":0.0,"noise_rate":0.0,"actionable_rate":0.0,"article_count":17,"cluster_count":0,"status":"keep","reason":"","learning_updates":{}}
{"run_id":"20260312_085508","timestamp":"2026-03-12T08:55:11.090870Z","params_snapshot":{},"hypothesis":"","mean_oss":0.0,"mean_coherence":0.0,"noise_rate":0.0,"actionable_rate":0.0,"article_count":17,"cluster_count":0,"status":"keep","reason":"","learning_updates":{}}
{"run_id":"20260312_085532","timestamp":"2026-03-12T08:55:35.557842Z","params_snapshot":{},"hypothesis":"","mean_oss":0.0,"mean_coherence":0.0,"noise_rate":0.0,"actionable_rate":0.0,"article_count":17,"cluster_count":0,"status":"keep","reason":"","learning_updates":{}}
{"run_id":"20260312_085535","timestamp":"2026-03-12T08:55:35.681776Z","params_snapshot":{},"hypothesis":"","mean_oss":0.0,"mean_coherence":0.0,"noise_rate":0.0,"actionable_rate":0.0,"article_count":17,"cluster_count":0,"status":"keep","reason":"","learning_updates":{}}
{"run_id":"20260312_085535","timestamp":"2026-03-12T08:55:36.167494Z","params_snapshot":{},"hypothesis":"","mean_oss":0.0,"mean_coherence":0.0,"noise_rate":0.0,"actionable_rate":0.0,"article_count":17,"cluster_count":0,"status":"keep","reason":"","learning_updates":{}}
{"run_id":"20260312_085850","timestamp":"2026-03-12T08:58:53.567907Z","params_snapshot":{},"hypothesis":"","mean_oss":0.0,"mean_coherence":0.0,"noise_rate":0.0,"actionable_rate":0.0,"article_count":17,"cluster_count":0,"status":"keep","reason":"","learning_updates":{}}
{"run_id":"20260312_085853","timestamp":"2026-03-12T08:58:53.694906Z","params_snapshot":{},"hypothesis":"","mean_oss":0.0,"mean_coherence":0.0,"noise_rate":0.0,"actionable_rate":0.0,"article_count":6,"cluster_count":0,"status":"keep","reason":"","learning_updates":{}}
{"run_id":"20260312_085853","timestamp":"2026-03-12T08:58:54.185915Z","params_snapshot":{},"hypothesis":"","mean_oss":0.0,"mean_coherence":0.0,"noise_rate":0.0,"actionable_rate":0.0,"article_count":17,"cluster_count":0,"status":"keep","reason":"","learning_updates":{}}
{"run_id":"20260312_085909","timestamp":"2026-03-12T08:59:12.022293Z","params_snapshot":{},"hypothesis":"","mean_oss":0.0,"mean_coherence":0.0,"noise_rate":0.0,"actionable_rate":0.0,"article_count":17,"cluster_count":0,"status":"keep","reason":"","learning_updates":{}}
{"run_id":"20260312_085912","timestamp":"2026-03-12T08:59:12.140243Z","params_snapshot":{},"hypothesis":"","mean_oss":0.0,"mean_coherence":0.0,"noise_rate":0.0,"actionable_rate":0.0,"article_count":6,"cluster_count":0,"status":"keep","reason":"","learning_updates":{}}
{"run_id":"20260312_085912","timestamp":"2026-03-12T08:59:12.659046Z","params_snapshot":{},"hypothesis":"","mean_oss":0.0,"mean_coherence":0.0,"noise_rate":0.0,"actionable_rate":0.0,"article_count":17,"cluster_count":0,"status":"keep","reason":"","learning_updates":{}}
{"run_id":"20260312_090003","timestamp":"2026-03-12T09:00:05.248115Z","params_snapshot":{},"hypothesis":"","mean_oss":0.0,"mean_coherence":0.0,"noise_rate":0.0,"actionable_rate":0.0,"article_count":17,"cluster_count":0,"status":"keep","reason":"","learning_updates":{}}
{"run_id":"20260312_090026","timestamp":"2026-03-12T09:00:28.243771Z","params_snapshot":{},"hypothesis":"","mean_oss":0.0,"mean_coherence":0.0,"noise_rate":0.0,"actionable_rate":0.0,"article_count":17,"cluster_count":0,"status":"keep","reason":"","learning_updates":{}}
{"run_id":"20260312_090055","timestamp":"2026-03-12T09:00:56.358711Z","params_snapshot":{},"hypothesis":"","mean_oss":0.0,"mean_coherence":0.0,"noise_rate":0.0,"actionable_rate":0.0,"article_count":17,"cluster_count":0,"status":"keep","reason":"","learning_updates":{}}
{"run_id":"20260312_090226","timestamp":"2026-03-12T09:02:29.640049Z","params_snapshot":{},"hypothesis":"","mean_oss":0.0,"mean_coherence":0.0,"noise_rate":0.0,"actionable_rate":0.0,"article_count":17,"cluster_count":0,"status":"keep","reason":"","learning_updates":{}}
{"run_id":"20260312_090229","timestamp":"2026-03-12T09:02:29.777050Z","params_snapshot":{},"hypothesis":"","mean_oss":0.0,"mean_coherence":0.0,"noise_rate":0.0,"actionable_rate":0.0,"article_count":6,"cluster_count":0,"status":"keep","reason":"","learning_updates":{}}
{"run_id":"20260312_090229","timestamp":"2026-03-12T09:02:30.248149Z","params_snapshot":{},"hypothesis":"","mean_oss":0.0,"mean_coherence":0.0,"noise_rate":0.0,"actionable_rate":0.0,"article_count":17,"cluster_count":0,"status":"keep","reason":"","learning_updates":{}}
{"run_id":"20260312_090253","timestamp":"2026-03-12T09:02:54.941829Z","params_snapshot":{},"hypothesis":"","mean_oss":0.0,"mean_coherence":0.0,"noise_rate":0.0,"actionable_rate":0.0,"article_count":17,"cluster_count":0,"status":"keep","reason":"","learning_updates":{}}
{"run_id":"20260312_090347","timestamp":"2026-03-12T09:03:48.607250Z","params_snapshot":{},"hypothesis":"","mean_oss":0.0,"mean_coherence":0.0,"noise_rate":0.0,"actionable_rate":0.0,"article_count":17,"cluster_count":0,"status":"keep","reason":"","learning_updates":{}}
{"run_id":"20260312_090436","timestamp":"2026-03-12T09:04:39.286428Z","params_snapshot":{},"hypothesis":"","mean_oss":0.0,"mean_coherence":0.0,"noise_rate":0.0,"actionable_rate":0.0,"article_count":17,"cluster_count":0,"status":"keep","reason":"","learning_updates":{}}
{"run_id":"20260312_090439","timestamp":"2026-03-12T09:04:39.402476Z","params_snapshot":{},"hypothesis":"","mean_oss":0.0,"mean_coherence":0.0,"noise_rate":0.0,"actionable_rate":0.0,"article_count":6,"cluster_count":0,"status":"keep","reason":"","learning_updates":{}}
{"run_id":"20260312_090439","timestamp":"2026-03-12T09:04:39.914073Z","params_snapshot":{},"hypothesis":"","mean_oss":0.0,"mean_coherence":0.0,"noise_rate":0.0,"actionable_rate":0.0,"article_count":17,"cluster_count":0,"status":"keep","reason":"","learning_updates":{}}
{"run_id":"20260312_091357","timestamp":"2026-03-12T09:14:00.017455Z","params_snapshot":{},"hypothesis":"","mean_oss":0.0,"mean_coherence":0.0,"noise_rate":0.0,"actionable_rate":0.0,"article_count":12,"cluster_count":0,"status":"keep","reason":"","learning_updates":{}}
{"run_id":"20260312_091731","timestamp":"2026-03-12T09:17:33.940455Z","params_snapshot":{},"hypothesis":"","mean_oss":0.0,"mean_coherence":0.0,"noise_rate":0.0,"actionable_rate":0.0,"article_count":17,"cluster_count":0,"status":"keep","reason":"","learning_updates":{}}
{"run_id":"20260312_091733","timestamp":"2026-03-12T09:17:34.077092Z","params_snapshot":{},"hypothesis":"","mean_oss":0.0,"mean_coherence":0.0,"noise_rate":0.0,"actionable_rate":0.0,"article_count":12,"cluster_count":0,"status":"keep","reason":"","learning_updates":{}}
{"run_id":"20260312_091734","timestamp":"2026-03-12T09:17:34.553150Z","params_snapshot":{},"hypothesis":"","mean_oss":0.0,"mean_coherence":0.0,"noise_rate":0.0,"actionable_rate":0.0,"article_count":17,"cluster_count":0,"status":"keep","reason":"","learning_updates":{}}
{"run_id":"20260312_092107","timestamp":"2026-03-12T09:21:10.244737Z","params_snapshot":{},"hypothesis":"","mean_oss":0.0,"mean_coherence":0.0,"noise_rate":0.0,"actionable_rate":0.0,"article_count":17,"cluster_count":0,"status":"keep","reason":"","learning_updates":{}}
{"run_id":"20260312_092110","timestamp":"2026-03-12T09:21:10.360745Z","params_snapshot":{},"hypothesis":"","mean_oss":0.0,"mean_coherence":0.0,"noise_rate":0.0,"actionable_rate":0.0,"article_count":12,"cluster_count":0,"status":"keep","reason":"","learning_updates":{}}
{"run_id":"20260312_092110","timestamp":"2026-03-12T09:21:10.849061Z","params_snapshot":{},"hypothesis":"","mean_oss":0.0,"mean_coherence":0.0,"noise_rate":0.0,"actionable_rate":0.0,"article_count":17,"cluster_count":0,"status":"keep","reason":"","learning_updates":{}}
{"run_id":"20260312_093558","timestamp":"2026-03-12T09:36:00.804365Z","params_snapshot":{},"hypothesis":"","mean_oss":0.0,"mean_coherence":0.0,"noise_rate":0.0,"actionable_rate":0.0,"article_count":17,"cluster_count":0,"status":"keep","reason":"","learning_updates":{}}
{"run_id":"20260312_093600","timestamp":"2026-03-12T09:36:00.924366Z","params_snapshot":{},"hypothesis":"","mean_oss":0.0,"mean_coherence":0.0,"noise_rate":0.0,"actionable_rate":0.0,"article_count":12,"cluster_count":0,"status":"keep","reason":"","learning_updates":{}}
{"run_id":"20260312_093600","timestamp":"2026-03-12T09:36:01.414528Z","params_snapshot":{},"hypothesis":"","mean_oss":0.0,"mean_coherence":0.0,"noise_rate":0.0,"actionable_rate":0.0,"article_count":17,"cluster_count":0,"status":"keep","reason":"","learning_updates":{}}
{"run_id":"20260312_094315","timestamp":"2026-03-12T09:43:17.315361Z","params_snapshot":{},"hypothesis":"","mean_oss":0.0,"mean_coherence":0.0,"noise_rate":0.0,"actionable_rate":0.0,"article_count":17,"cluster_count":0,"status":"keep","reason":"","learning_updates":{}}
{"run_id":"20260312_095207","timestamp":"2026-03-12T09:52:10.086106Z","params_snapshot":{},"hypothesis":"","mean_oss":0.0,"mean_coherence":0.0,"noise_rate":0.0,"actionable_rate":0.0,"article_count":17,"cluster_count":0,"status":"keep","reason":"","learning_updates":{}}
{"run_id":"20260312_100631","timestamp":"2026-03-12T10:06:33.027303Z","params_snapshot":{},"hypothesis":"","mean_oss":0.0,"mean_coherence":0.0,"noise_rate":0.0,"actionable_rate":0.0,"article_count":17,"cluster_count":0,"status":"keep","reason":"","learning_updates":{}}
{"run_id":"20260312_100744","timestamp":"2026-03-12T10:07:45.686094Z","params_snapshot":{},"hypothesis":"","mean_oss":0.0,"mean_coherence":0.0,"noise_rate":0.0,"actionable_rate":0.0,"article_count":17,"cluster_count":0,"status":"keep","reason":"","learning_updates":{}}
{"run_id":"20260312_102411","timestamp":"2026-03-12T10:24:12.466232Z","params_snapshot":{},"hypothesis":"","mean_oss":0.0,"mean_coherence":0.0,"noise_rate":0.0,"actionable_rate":0.0,"article_count":17,"cluster_count":0,"status":"keep","reason":"","learning_updates":{}}
{"run_id":"20260312_102449","timestamp":"2026-03-12T10:24:50.725384Z","params_snapshot":{},"hypothesis":"","mean_oss":0.0,"mean_coherence":0.0,"noise_rate":0.0,"actionable_rate":0.0,"article_count":17,"cluster_count":0,"status":"keep","reason":"","learning_updates":{}}
{"run_id":"20260312_102608","timestamp":"2026-03-12T10:26:11.600069Z","params_snapshot":{},"hypothesis":"","mean_oss":0.0,"mean_coherence":0.0,"noise_rate":0.0,"actionable_rate":0.0,"article_count":23,"cluster_count":0,"status":"keep","reason":"","learning_updates":{}}
{"run_id":"20260312_102611","timestamp":"2026-03-12T10:26:11.749068Z","params_snapshot":{},"hypothesis":"","mean_oss":0.0,"mean_coherence":0.0,"noise_rate":0.0,"actionable_rate":0.0,"article_count":23,"cluster_count":0,"status":"keep","reason":"","learning_updates":{}}
{"run_id":"20260312_102611","timestamp":"2026-03-12T10:26:12.208974Z","params_snapshot":{},"hypothesis":"","mean_oss":0.0,"mean_coherence":0.0,"noise_rate":0.0,"actionable_rate":0.0,"article_count":23,"cluster_count":0,"status":"keep","reason":"","learning_updates":{}}
{"run_id":"20260312_102624","timestamp":"2026-03-12T10:26:27.760284Z","params_snapshot":{},"hypothesis":"","mean_oss":0.0,"mean_coherence":0.0,"noise_rate":0.0,"actionable_rate":0.0,"article_count":12,"cluster_count":0,"status":"keep","reason":"","learning_updates":{}}
{"run_id":"20260312_102627","timestamp":"2026-03-12T10:26:27.881285Z","params_snapshot":{},"hypothesis":"","mean_oss":0.0,"mean_coherence":0.0,"noise_rate":0.0,"actionable_rate":0.0,"article_count":17,"cluster_count":0,"status":"keep","reason":"","learning_updates":{}}
{"run_id":"20260312_102627","timestamp":"2026-03-12T10:26:28.390784Z","params_snapshot":{},"hypothesis":"","mean_oss":0.0,"mean_coherence":0.0,"noise_rate":0.0,"actionable_rate":0.0,"article_count":17,"cluster_count":0,"status":"keep","reason":"","learning_updates":{}}
{"run_id":"20260312_102658","timestamp":"2026-03-12T10:27:01.616983Z","params_snapshot":{},"hypothesis":"","mean_oss":0.0,"mean_coherence":0.0,"noise_rate":0.0,"actionable_rate":0.0,"article_count":12,"cluster_count":0,"status":"keep","reason":"","learning_updates":{}}
{"run_id":"20260312_102701","timestamp":"2026-03-12T10:27:01.737984Z","params_snapshot":{},"hypothesis":"","mean_oss":0.0,"mean_coherence":0.0,"noise_rate":0.0,"actionable_rate":0.0,"article_count":17,"cluster_count":0,"status":"keep","reason":"","learning_updates":{}}
{"run_id":"20260312_102701","timestamp":"2026-03-12T10:27:02.224768Z","params_snapshot":{},"hypothesis":"","mean_oss":0.0,"mean_coherence":0.0,"noise_rate":0.0,"actionable_rate":0.0,"article_count":17,"cluster_count":0,"status":"keep","reason":"","learning_updates":{}}
{"run_id":"20260312_102819","timestamp":"2026-03-12T10:28:21.079766Z","params_snapshot":{},"hypothesis":"","mean_oss":0.0,"mean_coherence":0.0,"noise_rate":0.0,"actionable_rate":0.0,"article_count":17,"cluster_count":0,"status":"keep","reason":"","learning_updates":{}}
{"run_id":"20260312_103630","timestamp":"2026-03-12T10:36:32.185435Z","params_snapshot":{},"hypothesis":"","mean_oss":0.0,"mean_coherence":0.0,"noise_rate":0.0,"actionable_rate":0.0,"article_count":17,"cluster_count":0,"status":"keep","reason":"","learning_updates":{}}
{"run_id":"20260312_110556","timestamp":"2026-03-12T11:05:58.122029Z","params_snapshot":{},"hypothesis":"","mean_oss":0.0,"mean_coherence":0.0,"noise_rate":0.0,"actionable_rate":0.0,"article_count":17,"cluster_count":0,"status":"keep","reason":"","learning_updates":{}}
{"run_id":"20260312_110625","timestamp":"2026-03-12T11:06:25.187854Z","params_snapshot":{},"hypothesis":"","mean_oss":0.0,"mean_coherence":0.0,"noise_rate":0.0,"actionable_rate":0.0,"article_count":17,"cluster_count":0,"status":"keep","reason":"","learning_updates":{}}
{"run_id":"20260312_110642","timestamp":"2026-03-12T11:06:42.525262Z","params_snapshot":{},"hypothesis":"","mean_oss":0.0,"mean_coherence":0.0,"noise_rate":0.0,"actionable_rate":0.0,"article_count":12,"cluster_count":0,"status":"keep","reason":"","learning_updates":{}}
{"run_id":"20260312_110658","timestamp":"2026-03-12T11:06:58.181594Z","params_snapshot":{},"hypothesis":"","mean_oss":0.0,"mean_coherence":0.0,"noise_rate":0.0,"actionable_rate":0.0,"article_count":17,"cluster_count":0,"status":"keep","reason":"","learning_updates":{}}
{"run_id":"20260312_111532","timestamp":"2026-03-12T11:15:32.866687Z","params_snapshot":{},"hypothesis":"","mean_oss":0.0,"mean_coherence":0.0,"noise_rate":0.0,"actionable_rate":0.0,"article_count":17,"cluster_count":0,"status":"keep","reason":"","learning_updates":{}}
{"run_id":"20260312_112254","timestamp":"2026-03-12T11:22:57.965041Z","params_snapshot":{},"hypothesis":"","mean_oss":0.0,"mean_coherence":0.0,"noise_rate":0.0,"actionable_rate":0.0,"article_count":17,"cluster_count":0,"status":"keep","reason":"","learning_updates":{}}
{"run_id":"20260312_112313","timestamp":"2026-03-12T11:23:13.867773Z","params_snapshot":{},"hypothesis":"","mean_oss":0.0,"mean_coherence":0.0,"noise_rate":0.0,"actionable_rate":0.0,"article_count":17,"cluster_count":0,"status":"keep","reason":"","learning_updates":{}}
{"run_id":"20260312_112330","timestamp":"2026-03-12T11:23:31.250780Z","params_snapshot":{},"hypothesis":"","mean_oss":0.0,"mean_coherence":0.0,"noise_rate":0.0,"actionable_rate":0.0,"article_count":12,"cluster_count":0,"status":"keep","reason":"","learning_updates":{}}
{"run_id":"20260312_112357","timestamp":"2026-03-12T11:24:00.472549Z","params_snapshot":{},"hypothesis":"","mean_oss":0.0,"mean_coherence":0.0,"noise_rate":0.0,"actionable_rate":0.0,"article_count":17,"cluster_count":0,"status":"keep","reason":"","learning_updates":{}}
{"run_id":"20260313_111634","timestamp":"2026-03-13T11:16:37.100546Z","params_snapshot":{},"hypothesis":"","mean_oss":0.0,"mean_coherence":0.0,"noise_rate":0.0,"actionable_rate":0.0,"article_count":23,"cluster_count":0,"status":"keep","reason":"","learning_updates":{}}
{"run_id":"20260313_112042","timestamp":"2026-03-13T11:20:43.136872Z","params_snapshot":{},"hypothesis":"","mean_oss":0.0,"mean_coherence":0.0,"noise_rate":0.0,"actionable_rate":0.0,"article_count":17,"cluster_count":0,"status":"keep","reason":"","learning_updates":{}}
{"run_id":"20260313_112044","timestamp":"2026-03-13T11:20:44.570825Z","params_snapshot":{},"hypothesis":"","mean_oss":0.0,"mean_coherence":0.0,"noise_rate":0.0,"actionable_rate":0.0,"article_count":17,"cluster_count":0,"status":"keep","reason":"","learning_updates":{}}
{"run_id":"20260313_112045","timestamp":"2026-03-13T11:20:46.278595Z","params_snapshot":{},"hypothesis":"","mean_oss":0.0,"mean_coherence":0.0,"noise_rate":0.0,"actionable_rate":0.0,"article_count":23,"cluster_count":0,"status":"keep","reason":"","learning_updates":{}}
{"run_id":"20260313_112046","timestamp":"2026-03-13T11:20:46.843563Z","params_snapshot":{},"hypothesis":"","mean_oss":0.0,"mean_coherence":0.0,"noise_rate":0.0,"actionable_rate":0.0,"article_count":17,"cluster_count":0,"status":"keep","reason":"","learning_updates":{}}
{"run_id":"20260313_112046","timestamp":"2026-03-13T11:20:47.156854Z","params_snapshot":{},"hypothesis":"","mean_oss":0.0,"mean_coherence":0.0,"noise_rate":0.0,"actionable_rate":0.0,"article_count":17,"cluster_count":0,"status":"keep","reason":"","learning_updates":{}}
{"run_id":"20260313_112048","timestamp":"2026-03-13T11:20:48.497298Z","params_snapshot":{},"hypothesis":"","mean_oss":0.0,"mean_coherence":0.0,"noise_rate":0.0,"actionable_rate":0.0,"article_count":17,"cluster_count":0,"status":"keep","reason":"","learning_updates":{}}
{"run_id":"20260313_112049","timestamp":"2026-03-13T11:20:50.240552Z","params_snapshot":{},"hypothesis":"","mean_oss":0.0,"mean_coherence":0.0,"noise_rate":0.0,"actionable_rate":0.0,"article_count":23,"cluster_count":0,"status":"keep","reason":"","learning_updates":{}}
