{"run_id":"20260307_151646","timestamp":"2026-03-07T15:17:07.333625Z","params_snapshot":{},"hypothesis":"","mean_oss":0.0,"mean_coherence":0.0,"noise_rate":0.0,"actionable_rate":0.0,"article_count":17,"cluster_count":0,"status":"keep","reason":"","learning_updates":{}}
{"run_id":"20260307_152046","timestamp":"2026-03-07T15:22:52.452639Z","params_snapshot":{},"hypothesis":"","mean_oss":0.0,"mean_coherence":0.0,"noise_rate":0.0,"actionable_rate":0.0,"article_count":444,"cluster_count":0,"status":"keep","reason":"","learning_updates":{}}
{"run_id":"20260308_162003","timestamp":"2026-03-08T17:12:47.792924Z","params_snapshot":{},"hypothesis":"","mean_oss":0.0,"mean_coherence":0.0,"noise_rate":0.0,"actionable_rate":0.0,"article_count":271,"cluster_count":0,"status":"keep","reason":"","learning_updates":{}}
{"run_id":"20260309_104313","timestamp":"2026-03-09T11:36:23.152240Z","params_snapshot":{},"hypothesis":"","mean_oss":0.0,"mean_coherence":0.0,"noise_rate":0.0,"actionable_rate":0.0,"article_count":17,"cluster_count":8,"status":"keep","reason":"","learning_updates":{}}
{"run_id":"20260309_120804","timestamp":"2026-03-09T12:27:48.951313Z","params_snapshot":{},"hypothesis":"","mean_oss":0.0,"mean_coherence":0.0,"noise_rate":0.0,"actionable_rate":0.0,"article_count":0,"cluster_count":0,"status":"keep","reason":"","learning_updates":{}}
{"run_id":"20260309_114252","timestamp":"2026-03-09T13:39:19.000218Z","params_snapshot":{},"hypothesis":"","mean_oss":0.0,"mean_coherence":0.0,"noise_rate":0.0,"actionable_rate":0.0,"article_count":103,"cluster_count":8,"status":"keep","reason":"","learning_updates":{}}
{"run_id":"20260310_073556","timestamp":"2026-03-10T08:13:19.882898Z","params_snapshot":{},"hypothesis":"","mean_oss":0.0,"mean_coherence":0.0,"noise_rate":0.0,"actionable_rate":0.0,"article_count":367,"cluster_count":8,"status":"keep","reason":"","learning_updates":{}}
{"run_id":"20260310_095900","timestamp":"2026-03-10T10:12:05.102130Z","params_snapshot":{},"hypothesis":"","mean_oss":0.0,"mean_coherence":0.0,"noise_rate":0.0,"actionable_rate":0.0,"article_count":230,"cluster_count":8,"status":"keep","reason":"","learning_updates":{}}
{"run_id":"20260310_110650","timestamp":"2026-03-10T11:29:15.537783Z","params_snapshot":{},"hypothesis":"","mean_oss":0.0,"mean_coherence":0.0,"noise_rate":0.0,"actionable_rate":0.0,"article_count":299,"cluster_count":8,"status":"keep","reason":"","learning_updates":{}}
{"run_id":"20260310_115444","timestamp":"2026-03-10T12:22:22.299188Z","params_snapshot":{},"hypothesis":"","mean_oss":0.0,"mean_coherence":0.0,"noise_rate":0.0,"actionable_rate":0.0,"article_count":322,"cluster_count":8,"status":"keep","reason":"","learning_updates":{}}
{"run_id":"20260310_235115","timestamp":"2026-03-11T00:25:18.592379Z","params_snapshot":{},"hypothesis":"","mean_oss":0.75625,"mean_coherence":0.0,"noise_rate":0.0,"actionable_rate":1.0,"article_count":233,"cluster_count":8,"status":"keep","reason":"","learning_updates":{}}
{"run_id":"20260311_003251","timestamp":"2026-03-11T02:10:16.961261Z","params_snapshot":{},"hypothesis":"","mean_oss":0.6,"mean_coherence":0.0,"noise_rate":0.0,"actionable_rate":1.0,"article_count":196,"cluster_count":8,"status":"keep","reason":"","learning_updates":{}}
{"run_id":"20260311_030514","timestamp":"2026-03-11T03:30:24.942138Z","params_snapshot":{},"hypothesis":"","mean_oss":0.0,"mean_coherence":0.0,"noise_rate":0.0,"actionable_rate":0.0,"article_count":76,"cluster_count":0,"status":"discard","reason":"regression detected  - rolled back weights + thresholds","learning_updates":{}}
{"run_id":"20260311_065118","timestamp":"2026-03-11T06:52:41.434412Z","params_snapshot":{},"hypothesis":"","mean_oss":0.0,"mean_coherence":0.0,"noise_rate":0.0,"actionable_rate":0.0,"article_count":17,"cluster_count":0,"status":"discard","reason":"regression detected  - rolled back weights + thresholds","learning_updates":{}}
{"run_id":"20260311_063635","timestamp":"2026-03-11T07:04:18.857344Z","params_snapshot":{},"hypothesis":"","mean_oss":0.44375,"mean_coherence":0.0,"noise_rate":0.0,"actionable_rate":0.625,"article_count":17,"cluster_count":8,"status":"keep","reason":"","learning_updates":{}}
{"run_id":"20260311_070042","timestamp":"2026-03-11T07:30:34.701161Z","params_snapshot":{},"hypothesis":"","mean_oss":0.69375,"mean_coherence":0.0,"noise_rate":0.0,"actionable_rate":1.0,"article_count":17,"cluster_count":8,"status":"keep","reason":"","learning_updates":{}}
{"run_id":"20260311_073042","timestamp":"2026-03-11T08:07:35.058482Z","params_snapshot":{},"hypothesis":"","mean_oss":0.575,"mean_coherence":0.0,"noise_rate":0.0,"actionable_rate":0.75,"article_count":17,"cluster_count":8,"status":"keep","reason":"","learning_updates":{}}
{"run_id":"20260311_073400","timestamp":"2026-03-11T08:12:07.501442Z","params_snapshot":{},"hypothesis":"","mean_oss":0.65,"mean_coherence":0.0,"noise_rate":0.0,"actionable_rate":0.875,"article_count":17,"cluster_count":8,"status":"keep","reason":"","learning_updates":{}}
{"run_id":"20260311_083805","timestamp":"2026-03-11T09:08:24.322760Z","params_snapshot":{},"hypothesis":"","mean_oss":0.51875,"mean_coherence":0.0,"noise_rate":0.0,"actionable_rate":0.875,"article_count":96,"cluster_count":8,"status":"keep","reason":"","learning_updates":{}}
{"run_id":"20260311_090824","timestamp":"2026-03-11T09:42:11.530453Z","params_snapshot":{},"hypothesis":"","mean_oss":0.7875,"mean_coherence":0.0,"noise_rate":0.0,"actionable_rate":1.0,"article_count":308,"cluster_count":8,"status":"keep","reason":"","learning_updates":{}}
{"run_id":"20260311_182057","timestamp":"2026-03-11T18:56:02.543928Z","params_snapshot":{},"hypothesis":"","mean_oss":0.725,"mean_coherence":0.0,"noise_rate":0.0,"actionable_rate":1.0,"article_count":17,"cluster_count":8,"status":"keep","reason":"","learning_updates":{}}
{"run_id":"20260311_182847","timestamp":"2026-03-11T19:12:02.815221Z","params_snapshot":{},"hypothesis":"","mean_oss":0.75625,"mean_coherence":0.0,"noise_rate":0.0,"actionable_rate":1.0,"article_count":17,"cluster_count":8,"status":"keep","reason":"","learning_updates":{}}
{"run_id":"20260311_184214","timestamp":"2026-03-11T19:15:39.200525Z","params_snapshot":{},"hypothesis":"","mean_oss":0.69375,"mean_coherence":0.0,"noise_rate":0.0,"actionable_rate":1.0,"article_count":17,"cluster_count":8,"status":"keep","reason":"","learning_updates":{}}
{"run_id":"20260311_184105","timestamp":"2026-03-11T19:32:43.818981Z","params_snapshot":{},"hypothesis":"","mean_oss":0.725,"mean_coherence":0.0,"noise_rate":0.0,"actionable_rate":1.0,"article_count":17,"cluster_count":8,"status":"keep","reason":"","learning_updates":{}}
{"run_id":"20260311_193844","timestamp":"2026-03-11T19:46:50.487810Z","params_snapshot":{},"hypothesis":"","mean_oss":0.675,"mean_coherence":0.0,"noise_rate":0.0,"actionable_rate":1.0,"article_count":17,"cluster_count":2,"status":"keep","reason":"","learning_updates":{}}
{"run_id":"20260311_185603","timestamp":"2026-03-11T19:50:12.847960Z","params_snapshot":{},"hypothesis":"","mean_oss":0.725,"mean_coherence":0.0,"noise_rate":0.0,"actionable_rate":1.0,"article_count":17,"cluster_count":8,"status":"keep","reason":"","learning_updates":{}}
{"run_id":"20260311_194116","timestamp":"2026-03-11T19:54:53.159472Z","params_snapshot":{},"hypothesis":"","mean_oss":0.65,"mean_coherence":0.0,"noise_rate":0.0,"actionable_rate":0.6666666666666666,"article_count":17,"cluster_count":3,"status":"keep","reason":"","learning_updates":{}}
{"run_id":"20260311_190934","timestamp":"2026-03-11T19:56:54.388720Z","params_snapshot":{},"hypothesis":"","mean_oss":0.69375,"mean_coherence":0.0,"noise_rate":0.0,"actionable_rate":0.875,"article_count":17,"cluster_count":8,"status":"keep","reason":"","learning_updates":{}}
{"run_id":"20260311_200003","timestamp":"2026-03-11T20:09:20.314323Z","params_snapshot":{},"hypothesis":"","mean_oss":0.675,"mean_coherence":0.0,"noise_rate":0.0,"actionable_rate":1.0,"article_count":17,"cluster_count":2,"status":"keep","reason":"","learning_updates":{}}
{"run_id":"20260311_200821","timestamp":"2026-03-11T20:20:19.363684Z","params_snapshot":{},"hypothesis":"","mean_oss":0.55,"mean_coherence":0.0,"noise_rate":0.0,"actionable_rate":0.5,"article_count":17,"cluster_count":2,"status":"discard","reason":"regression detected  - rolled back weights + thresholds","learning_updates":{}}
{"run_id":"20260311_191203","timestamp":"2026-03-11T20:22:37.391701Z","params_snapshot":{},"hypothesis":"","mean_oss":0.725,"mean_coherence":0.0,"noise_rate":0.0,"actionable_rate":0.875,"article_count":17,"cluster_count":8,"status":"keep","reason":"","learning_updates":{}}
{"run_id":"20260311_201231","timestamp":"2026-03-11T20:22:54.146300Z","params_snapshot":{},"hypothesis":"","mean_oss":0.55,"mean_coherence":0.0,"noise_rate":0.0,"actionable_rate":0.5,"article_count":17,"cluster_count":2,"status":"discard","reason":"regression detected  - rolled back weights + thresholds","learning_updates":{}}
{"run_id":"20260311_201130","timestamp":"2026-03-11T20:23:27.624678Z","params_snapshot":{},"hypothesis":"","mean_oss":0.55,"mean_coherence":0.0,"noise_rate":0.0,"actionable_rate":0.5,"article_count":17,"cluster_count":2,"status":"discard","reason":"regression detected  - rolled back weights + thresholds","learning_updates":{}}
{"run_id":"20260311_201619","timestamp":"2026-03-11T20:28:53.567450Z","params_snapshot":{},"hypothesis":"","mean_oss":0.55,"mean_coherence":0.0,"noise_rate":0.0,"actionable_rate":0.5,"article_count":17,"cluster_count":2,"status":"discard","reason":"regression detected  - rolled back weights + thresholds","learning_updates":{}}
{"run_id":"20260311_202724","timestamp":"2026-03-11T20:37:27.692628Z","params_snapshot":{},"hypothesis":"","mean_oss":0.55,"mean_coherence":0.0,"noise_rate":0.0,"actionable_rate":0.5,"article_count":17,"cluster_count":2,"status":"discard","reason":"regression detected  - rolled back weights + thresholds","learning_updates":{}}
{"run_id":"20260311_202928","timestamp":"2026-03-11T20:40:20.772420Z","params_snapshot":{},"hypothesis":"","mean_oss":0.55,"mean_coherence":0.0,"noise_rate":0.0,"actionable_rate":0.5,"article_count":17,"cluster_count":2,"status":"discard","reason":"regression detected  - rolled back weights + thresholds","learning_updates":{}}
{"run_id":"20260311_203428","timestamp":"2026-03-11T20:45:10.063249Z","params_snapshot":{},"hypothesis":"","mean_oss":0.675,"mean_coherence":0.0,"noise_rate":0.0,"actionable_rate":1.0,"article_count":17,"cluster_count":2,"status":"keep","reason":"","learning_updates":{}}
{"run_id":"20260311_195013","timestamp":"2026-03-11T20:47:05.585932Z","params_snapshot":{},"hypothesis":"","mean_oss":0.725,"mean_coherence":0.0,"noise_rate":0.0,"actionable_rate":1.0,"article_count":17,"cluster_count":8,"status":"keep","reason":"","learning_updates":{}}
{"run_id":"20260311_205132","timestamp":"2026-03-11T20:57:15.578276Z","params_snapshot":{},"hypothesis":"","mean_oss":0.675,"mean_coherence":0.0,"noise_rate":0.0,"actionable_rate":1.0,"article_count":17,"cluster_count":2,"status":"keep","reason":"","learning_updates":{}}
{"run_id":"20260311_205156","timestamp":"2026-03-11T20:57:40.303266Z","params_snapshot":{},"hypothesis":"","mean_oss":0.55,"mean_coherence":0.0,"noise_rate":0.0,"actionable_rate":0.5,"article_count":17,"cluster_count":2,"status":"discard","reason":"regression detected  - rolled back weights + thresholds","learning_updates":{}}
{"run_id":"20260311_205924","timestamp":"2026-03-11T21:04:06.951169Z","params_snapshot":{},"hypothesis":"","mean_oss":0.55,"mean_coherence":0.0,"noise_rate":0.0,"actionable_rate":0.5,"article_count":17,"cluster_count":2,"status":"discard","reason":"regression detected  - rolled back weights + thresholds","learning_updates":{}}
{"run_id":"20260311_210510","timestamp":"2026-03-11T21:10:16.430289Z","params_snapshot":{},"hypothesis":"","mean_oss":0.55,"mean_coherence":0.0,"noise_rate":0.0,"actionable_rate":0.5,"article_count":17,"cluster_count":2,"status":"discard","reason":"regression detected  - rolled back weights + thresholds","learning_updates":{}}
{"run_id":"20260311_202242","timestamp":"2026-03-11T21:16:21.016624Z","params_snapshot":{},"hypothesis":"","mean_oss":0.725,"mean_coherence":0.0,"noise_rate":0.0,"actionable_rate":0.875,"article_count":17,"cluster_count":8,"status":"keep","reason":"","learning_updates":{}}
{"run_id":"20260311_211904","timestamp":"2026-03-11T21:23:04.740292Z","params_snapshot":{},"hypothesis":"","mean_oss":0.55,"mean_coherence":0.0,"noise_rate":0.0,"actionable_rate":0.5,"article_count":17,"cluster_count":2,"status":"discard","reason":"regression detected  - rolled back weights + thresholds","learning_updates":{}}
{"run_id":"20260311_211904","timestamp":"2026-03-11T21:27:35.041084Z","params_snapshot":{},"hypothesis":"","mean_oss":0.55,"mean_coherence":0.0,"noise_rate":0.0,"actionable_rate":0.5,"article_count":17,"cluster_count":2,"status":"discard","reason":"regression detected  - rolled back weights + thresholds","learning_updates":{}}
{"run_id":"20260311_211628","timestamp":"2026-03-11T21:27:39.789215Z","params_snapshot":{},"hypothesis":"","mean_oss":0.675,"mean_coherence":0.0,"noise_rate":0.0,"actionable_rate":1.0,"article_count":17,"cluster_count":2,"status":"keep","reason":"","learning_updates":{}}
{"run_id":"20260311_212456","timestamp":"2026-03-11T21:30:32.549651Z","params_snapshot":{},"hypothesis":"","mean_oss":0.55,"mean_coherence":0.0,"noise_rate":0.0,"actionable_rate":0.5,"article_count":17,"cluster_count":2,"status":"discard","reason":"regression detected  - rolled back weights + thresholds","learning_updates":{}}
{"run_id":"20260311_212713","timestamp":"2026-03-11T21:35:14.114841Z","params_snapshot":{},"hypothesis":"","mean_oss":0.55,"mean_coherence":0.0,"noise_rate":0.0,"actionable_rate":0.5,"article_count":17,"cluster_count":2,"status":"discard","reason":"regression detected  - rolled back weights + thresholds","learning_updates":{}}
{"run_id":"20260311_213316","timestamp":"2026-03-11T21:40:34.395526Z","params_snapshot":{},"hypothesis":"","mean_oss":0.55,"mean_coherence":0.0,"noise_rate":0.0,"actionable_rate":0.5,"article_count":17,"cluster_count":2,"status":"discard","reason":"regression detected  - rolled back weights + thresholds","learning_updates":{}}
{"run_id":"20260311_213747","timestamp":"2026-03-11T21:42:00.616376Z","params_snapshot":{},"hypothesis":"","mean_oss":0.55,"mean_coherence":0.0,"noise_rate":0.0,"actionable_rate":0.5,"article_count":17,"cluster_count":2,"status":"discard","reason":"regression detected  - rolled back weights + thresholds","learning_updates":{}}
{"run_id":"20260311_213533","timestamp":"2026-03-11T21:51:47.120486Z","params_snapshot":{},"hypothesis":"","mean_oss":0.55,"mean_coherence":0.0,"noise_rate":0.0,"actionable_rate":0.5,"article_count":17,"cluster_count":2,"status":"discard","reason":"regression detected  - rolled back weights + thresholds","learning_updates":{}}
{"run_id":"20260311_215149","timestamp":"2026-03-11T21:57:52.885837Z","params_snapshot":{},"hypothesis":"","mean_oss":0.55,"mean_coherence":0.0,"noise_rate":0.0,"actionable_rate":0.5,"article_count":17,"cluster_count":2,"status":"discard","reason":"regression detected  - rolled back weights + thresholds","learning_updates":{}}
{"run_id":"20260311_215752","timestamp":"2026-03-11T22:05:15.116173Z","params_snapshot":{},"hypothesis":"","mean_oss":0.575,"mean_coherence":0.0,"noise_rate":0.0,"actionable_rate":0.75,"article_count":17,"cluster_count":4,"status":"discard","reason":"regression detected  - rolled back weights + thresholds","learning_updates":{}}
{"run_id":"20260311_220515","timestamp":"2026-03-11T22:09:01.376891Z","params_snapshot":{},"hypothesis":"","mean_oss":0.5,"mean_coherence":0.0,"noise_rate":0.0,"actionable_rate":1.0,"article_count":17,"cluster_count":1,"status":"keep","reason":"","learning_updates":{}}
{"run_id":"20260311_220305","timestamp":"2026-03-11T22:09:59.902254Z","params_snapshot":{},"hypothesis":"","mean_oss":0.55,"mean_coherence":0.0,"noise_rate":0.0,"actionable_rate":0.5,"article_count":17,"cluster_count":2,"status":"discard","reason":"regression detected  - rolled back weights + thresholds","learning_updates":{}}
{"run_id":"20260311_221423","timestamp":"2026-03-11T22:20:40.169977Z","params_snapshot":{},"hypothesis":"","mean_oss":0.55,"mean_coherence":0.0,"noise_rate":0.0,"actionable_rate":0.5,"article_count":17,"cluster_count":2,"status":"discard","reason":"regression detected  - rolled back weights + thresholds","learning_updates":{}}
{"run_id":"20260311_221659","timestamp":"2026-03-11T22:24:23.545622Z","params_snapshot":{},"hypothesis":"","mean_oss":0.55,"mean_coherence":0.0,"noise_rate":0.0,"actionable_rate":0.5,"article_count":17,"cluster_count":2,"status":"discard","reason":"regression detected  - rolled back weights + thresholds","learning_updates":{}}
{"run_id":"20260311_221715","timestamp":"2026-03-11T22:25:25.013734Z","params_snapshot":{},"hypothesis":"","mean_oss":0.55,"mean_coherence":0.0,"noise_rate":0.0,"actionable_rate":0.5,"article_count":17,"cluster_count":2,"status":"discard","reason":"regression detected  - rolled back weights + thresholds","learning_updates":{}}
{"run_id":"20260311_222302","timestamp":"2026-03-11T22:30:11.449178Z","params_snapshot":{},"hypothesis":"","mean_oss":0.675,"mean_coherence":0.0,"noise_rate":0.0,"actionable_rate":1.0,"article_count":17,"cluster_count":2,"status":"keep","reason":"","learning_updates":{}}
{"run_id":"20260311_223631","timestamp":"2026-03-11T22:42:00.285891Z","params_snapshot":{},"hypothesis":"","mean_oss":0.55,"mean_coherence":0.0,"noise_rate":0.0,"actionable_rate":0.5,"article_count":17,"cluster_count":2,"status":"discard","reason":"regression detected  - rolled back weights + thresholds","learning_updates":{}}
{"run_id":"20260311_223645","timestamp":"2026-03-11T22:45:23.809076Z","params_snapshot":{},"hypothesis":"","mean_oss":0.675,"mean_coherence":0.0,"noise_rate":0.0,"actionable_rate":1.0,"article_count":17,"cluster_count":2,"status":"keep","reason":"","learning_updates":{}}
{"run_id":"20260311_224653","timestamp":"2026-03-11T22:49:55.924612Z","params_snapshot":{},"hypothesis":"","mean_oss":0.55,"mean_coherence":0.0,"noise_rate":0.0,"actionable_rate":0.5,"article_count":17,"cluster_count":2,"status":"discard","reason":"regression detected  - rolled back weights + thresholds","learning_updates":{}}
{"run_id":"20260311_224229","timestamp":"2026-03-11T22:51:38.347136Z","params_snapshot":{},"hypothesis":"","mean_oss":0.55,"mean_coherence":0.0,"noise_rate":0.0,"actionable_rate":0.5,"article_count":17,"cluster_count":2,"status":"discard","reason":"regression detected  - rolled back weights + thresholds","learning_updates":{}}
{"run_id":"20260311_225000","timestamp":"2026-03-11T22:54:49.541714Z","params_snapshot":{},"hypothesis":"","mean_oss":0.675,"mean_coherence":0.0,"noise_rate":0.0,"actionable_rate":1.0,"article_count":17,"cluster_count":2,"status":"keep","reason":"","learning_updates":{}}
{"run_id":"20260311_225244","timestamp":"2026-03-11T23:00:54.101374Z","params_snapshot":{},"hypothesis":"","mean_oss":0.675,"mean_coherence":0.0,"noise_rate":0.0,"actionable_rate":1.0,"article_count":17,"cluster_count":2,"status":"keep","reason":"","learning_updates":{}}
{"run_id":"20260311_225558","timestamp":"2026-03-11T23:05:10.087185Z","params_snapshot":{},"hypothesis":"","mean_oss":0.675,"mean_coherence":0.0,"noise_rate":0.0,"actionable_rate":1.0,"article_count":17,"cluster_count":2,"status":"keep","reason":"","learning_updates":{}}
{"run_id":"20260311_225847","timestamp":"2026-03-11T23:16:29.954628Z","params_snapshot":{},"hypothesis":"","mean_oss":0.55,"mean_coherence":0.0,"noise_rate":0.0,"actionable_rate":0.5,"article_count":17,"cluster_count":2,"status":"discard","reason":"regression detected  - rolled back weights + thresholds","learning_updates":{}}
{"run_id":"20260311_232744","timestamp":"2026-03-11T23:28:52.382748Z","params_snapshot":{},"hypothesis":"","mean_oss":0.25,"mean_coherence":0.0,"noise_rate":0.0,"actionable_rate":0.0,"article_count":17,"cluster_count":2,"status":"discard","reason":"regression detected  - rolled back weights + thresholds","learning_updates":{}}
{"run_id":"20260311_234855","timestamp":"2026-03-11T23:49:17.659238Z","params_snapshot":{},"hypothesis":"","mean_oss":0.0,"mean_coherence":0.0,"noise_rate":0.0,"actionable_rate":0.0,"article_count":17,"cluster_count":0,"status":"discard","reason":"regression detected  - rolled back weights + thresholds","learning_updates":{}}
{"run_id":"20260311_235708","timestamp":"2026-03-11T23:57:31.159157Z","params_snapshot":{},"hypothesis":"","mean_oss":0.0,"mean_coherence":0.0,"noise_rate":0.0,"actionable_rate":0.0,"article_count":17,"cluster_count":0,"status":"discard","reason":"regression detected  - rolled back weights + thresholds","learning_updates":{}}
{"run_id":"20260312_000312","timestamp":"2026-03-12T00:03:36.854500Z","params_snapshot":{},"hypothesis":"","mean_oss":0.0,"mean_coherence":0.0,"noise_rate":0.0,"actionable_rate":0.0,"article_count":17,"cluster_count":0,"status":"discard","reason":"regression detected  - rolled back weights + thresholds","learning_updates":{}}
{"run_id":"20260312_015304","timestamp":"2026-03-12T01:53:30.516626Z","params_snapshot":{},"hypothesis":"","mean_oss":0.0,"mean_coherence":0.0,"noise_rate":0.0,"actionable_rate":0.0,"article_count":17,"cluster_count":0,"status":"discard","reason":"regression detected  - rolled back weights + thresholds","learning_updates":{}}
{"run_id":"20260312_021102","timestamp":"2026-03-12T02:11:25.998270Z","params_snapshot":{},"hypothesis":"","mean_oss":0.0,"mean_coherence":0.0,"noise_rate":0.0,"actionable_rate":0.0,"article_count":17,"cluster_count":0,"status":"discard","reason":"regression detected  - rolled back weights + thresholds","learning_updates":{}}
